{
  "$schema": "http://json-schema.org/draft-07/schema#",
  "title": "Wearable Data Schema",
  "description": "Standardized schema for wearable device data",
  "type": "object",
  "required": ["timestamp"],
  "properties": {
    "timestamp": {
      "type": "string",
      "format": "date-time",
      "description": "ISO 8601 timestamp of the measurement"
    },
    "hrv": {
      "type": "number",
      "description": "Heart Rate Variability (ms)",
      "minimum": 0
    },
    "sleep_quality": {
      "type": "number",
      "description": "Sleep quality score (0-100)",
      "minimum": 0,
      "maximum": 100
    },
    "activity_level": {
      "type": "number",
      "description": "Activity level score (0-100)",
      "minimum": 0,
      "maximum": 100
    },
    "subjective_recovery": {
      "type": "number",
      "description": "Subjective recovery score (0-100)",
      "minimum": 0,
      "maximum": 100
    },
    "notes": {
      "type": "string",
      "description": "Optional notes or comments"
    },
    "metadata": {
      "type": "object",
      "description": "Additional metadata about the measurement",
      "properties": {
        "source": {
          "type": "string",
          "description": "Source of the data (e.g., 'whoop', 'oura', 'garmin')"
        },
        "device_id": {
          "type": "string",
          "description": "Identifier for the device that collected the data"
        },
        "version": {
          "type": "string",
          "description": "Version of the data format"
        }
      }
    }
  }
}
